	<!ELEMENT placas (placa*)>
	<!ELEMENT placa (microprocesador?, memoria?, modelo?, fabricante?)*>
	<!ELEMENT microprocesador (#PCDATA)>
	<!ELEMENT memoria (#PCDATA)>
	<!ELEMENT modelo (#PCDATA)>
	<!ELEMENT fabricante (Asus | Intel)>
	<!ELEMENT Asus EMPTY>
	<!ELEMENT Intel EMPTY>